q_index,query_type,notes,question
113,direct-lookup,FY2017 total current liabilities direct extract,What is Netflix's year end FY2017 total current liabilities (in USD millions)? Base your judgments on the information provided primarily in the balance sheet.
114,calculation,Three year COGS percent revenue average,"We need to calculate a reasonable approximation (or exact number if possible) of a financial metric. Basing your judgment by information plainly provided in the statement of income, what is Nike's three year average of cost of goods sold as a % of revenue from FY2016 to FY2018? Answer in units of percents and round to one decimal place."
115,direct-lookup,FY2019 total current assets direct statement,"According to the details clearly outlined within the balance sheet, how much total current assets did Nike have at the end of FY2019? Answer in USD millions."
116,calculation,Inventory turnover COGS average inventory,"When primarily referencing the income statement and the statement of financial position, what is the FY2021 inventory turnover ratio for Nike? Inventory turnover ratio is defined as: (FY2021 COGS) / (average inventory between FY2020 and FY2021). Round your answer to two decimal places."
117,comparative,Cash flow activities ranking most positive,"Among operations, investing, and financing activities, which brought in the most (or lost the least) cash flow for Nike in FY2023?"
118,conceptual,Working capital relevance judgment fintech,"Does Paypal have positive working capital based on FY2022 data? If working capital is not a useful or relevant metric for this company, then please state that and explain why."
119,direct-lookup,FY2021 capex direct cash flow extraction,What is the FY2021 capital expenditure amount (in USD billions) for PepsiCo? Respond to the question by assuming the perspective of an investment analyst who can only use the details shown within the statement of cash flows.
120,direct-lookup,Primary geographic operations identification,What are the geographies that Pepsico primarily operates in as of FY2022?
121,direct-lookup,Material ongoing legal battle disclosure,Has Pepsico reported any materially important ongoing legal battles from FY2022 and FY2021?
122,direct-lookup,FY2022 restructuring costs income statement,What is the quantity of restructuring costs directly outlined in Pepsico's income statements for FY2022? If restructuring costs are not explicitly outlined then state 0.
123,calculation,EBITDA less capex multi-step formula,What is the FY2022 unadjusted EBITDA less capex for PepsiCo? Define unadjusted EBITDA as unadjusted operating income + depreciation and amortization [from cash flow statement]. Answer in USD millions. Respond to the question by assuming the perspective of an investment analyst who can only use the details shown within the statement of cash flows and the income statement.
124,calculation,Unadjusted EBITDA percent margin calculation,What is the FY2022 unadjusted EBITDA % margin for PepsiCo? Calculate unadjusted EBITDA using unadjusted operating income and D&A (from cash flow statement). Give a response to the question by relying on the details shown in the statement of cash flows and the P&L statement.
125,direct-lookup,AGM vote outcome net-zero emissions report,"At the Pepsico AGM held on May 3, 2023, what was the outcome of the shareholder vote on the shareholder proposal for a congruency report by Pepsico on net-zero emissions policies?"
126,direct-lookup,Revolving credit facility increase amount,"By how much did Pepsico increase its unsecured five year revolving credit agreement on May 26, 2023?"
127,direct-lookup,Total revolving credit agreements capacity,"As of May 26, 2023, what is the total amount Pepsico may borrow under its unsecured revolving credit agreements?"
128,conceptual,Guidance raise reasoning driver attribution,"As of FY2023Q1, why did Pepsico raise full year guidance for FY2023?"
129,direct-lookup,EPS guidance raise percentage points amount,"As of FY2023Q1, by how many percentage points did Pepsico raise full year guidance in respect of core constant currency EPS growth?"
130,comparative,PPNE growth FY20 to FY21 comparison,Did Pfizer grow its PPNE between FY20 and FY21?
131,conceptual,Non-standard business events net income impact,Were there any potential events that are not in Pfizer's standard business operations that substantially increased net income in 2019?
132,direct-lookup,Three major company acquisitions identified,What are three main companies acquired by Pfizer mentioned in this 10K report?
133,direct-lookup,Upjohn spinoff expected cost amount,How much does Pfizer expect to pay to spin off Upjohn in the future in USD million?
134,comparative,Geographic region largest revenue drop percentage,"For Pfizer, which geographic region had the biggest drop in Q22023 year over year revenues (on a percentage basis)?"
135,direct-lookup,Large business segment spinoff identification Q2,"As of Q2'2023, is Pfizer spinning off any large business segments?"
136,direct-lookup,Registered debt securities national exchange,Which debt securities are registered to trade on a national securities exchange under Ulta Beauty's name as of FY2023?
137,direct-lookup,Major acquisitions FY2023 FY2022,What are major acquisitions that Ulta Beauty has done in FY2023 and FY2022?
138,conceptual,SGA expense reduction drivers attribution,What drove the reduction in SG&A expense as a percent of net sales in FY2023?
139,conceptual,Merchandise inventory increase drivers attribution,What drove the increase in Ulta Beauty's merchandise inventories balance at end of FY2023?
140,calculation,Stock repurchase Q4 percent total spend,What percent of Ulta Beauty's total spend on stock repurchases for FY 2023 occurred in Q4 of FY2023?
141,comparative,Wages expense percent sales FY2023 trend,Did Ulta Beauty's wages expense as a percent of net sales increase or decrease in FY2023?
142,comparative,Derivative notional value highest ranking,"Among all of the derivative instruments that Verizon used to manage the exposure to fluctuations of foreign currencies exchange rates or interest rates, which one had the highest notional value in FY 2021?"
143,direct-lookup,Retirees expected payment 2024 amount,"As of FY 2021, how much did Verizon expect to pay for its retirees in 2024?"
144,conceptual,Quick ratio liquidity assessment relevance,"Does Verizon have a reasonably healthy liquidity profile based on its quick ratio for FY 2022? If the quick ratio is not relevant to measure liquidity, please state that and explain why."
145,conceptual,Capital intensity judgment FY2022 data,Is Verizon a capital intensive business based on FY 2022 data?
146,comparative,Debt increase 2022 vs 2021 comparison,Has Verizon increased its debt on balance sheet between 2022 and the 2021 fiscal period?
147,calculation,DPO formula average payable COGS change,What is FY2018 days payable outstanding (DPO) for Walmart? DPO is defined as: 365 * (average accounts payable between FY2017 and FY2018) / (FY2018 COGS + change in inventory between FY2017 and FY2018). Round your answer to two decimal places. Please base your judgments on the information provided primarily in the statement of financial position and the P&L statement.
148,calculation,Operating income margin change FY2018-2019,"Based on the information provided primarily in the statement of income, what is the FY2018 - FY2019 change in unadjusted operating income % margin for Walmart? Answer in units of percents and round to one decimal place."
149,calculation,Three year EBITDA margin percent average,What is the FY2018 - FY2020 3 year average unadjusted EBITDA % margin for Walmart? Define unadjusted EBITDA as unadjusted operating income + depreciation and amortization from the cash flow statement. Answer in units of percents and round to one decimal place. Calculate what was asked by utilizing the line items clearly shown in the P&L statement and the cash flow statement.
